{
  "$schema": "https://json-schema.org/draft/2020-12/schema",
  "$id": "https://schemas.wmo.int/wnm/1.1.0/schemas/wis2-notification-message-bundled.json",
  "title": "WIS2 Notification Message Encoding",
  "description": "WIS2 Notification Message Encoding",
  "type": "object",
  "properties": {
    "id": {
      "type": "string",
      "format": "uuid",
      "description": "UUID (RFC4122) - Guarantee uniqueness of the message over (at least) a 24h period."
    },
    "conformsTo": {
      "type": "array",
      "contains": {
        "const": "http://wis.wmo.int/spec/wnm/1/conf/core"
      }
    },
    "type": {
      "type": "string",
      "enum": [
        "Feature"
      ]
    },
    "geometry": {
      "oneOf": [
        {
          "enum": [
            null
          ]
        },
        {
          "type": "object",
          "required": [
            "type",
            "coordinates"
          ],
          "properties": {
            "type": {
              "type": "string",
              "const": "Point"
            },
            "coordinates": {
              "type": "array",
              "minItems": 2,
              "items": {
                "type": "number"
              }
            }
          }
        },
        {
          "type": "object",
          "required": [
            "type",
            "coordinates"
          ],
          "properties": {
            "type": {
              "type": "string",
              "const": "Polygon"
            },
            "coordinates": {
              "type": "array",
              "items": {
                "type": "array",
                "minItems": 4,
                "items": {
                  "type": "array",
                  "minItems": 2,
                  "items": {
                    "type": "number"
                  }
                }
              }
            }
          }
        }
      ]
    },
    "properties": {
      "type": "object",
      "properties": {
        "pubtime": {
          "type": "string",
          "format": "date-time",
          "description": "Identifies the date/time of when the file was posted/published, in RFC3339 format.\nThe publication date/time is critical for subscribers to prevent message loss by knowing\ntheir lag (how far behind the publisher they are).\n"
        },
        "data_id": {
          "type": "string",
          "description": "Unique identifier of the data as defined by the data producer.\nData producers SHOULD NOT use an opaque id, but something meaningful to support client side filtering.\n"
        },
        "metadata_id": {
          "type": "string",
          "description": "Identifier for associated discovery metadata record to which the notification applies to.\nThe identification SHOULD be from a WCMP2 discovery metadata record identifier from the WIS2\nGlobal Discovery Catalogue. Identifiers based on external catalogue systems MAY be articulated as additional links.\n"
        },
        "producer": {
          "type": "string",
          "description": "Identifies the provider that initially captured and processed the source data, in support of data distribution on behalf of other Members.\n"
        },
        "global-cache": {
          "type": "string",
          "description": "Centre identifier of Global Cache Service producing the notification.\n"
        },
        "datetime": {
          "type": [
            "string",
            "null"
          ],
          "format": "date-time",
          "description": "Identifies the date/time of the data being published, in RFC3339 format."
        },
        "start_datetime": {
          "type": "string",
          "format": "date-time",
          "description": "Identifies the start date/time date of the data being published, in RFC3339 format."
        },
        "end_datetime": {
          "type": "string",
          "format": "date-time",
          "description": "Identifies the end date/time date of the data being published, in RFC3339 format."
        },
        "cache": {
          "type": "boolean",
          "description": "Whether the data in the notification should be cached (if not specified, the default value is `true`).\nWhen set to `false`, WIS2 Global Cache services do not cache the canonical link, and publish the\nnotification with an unmodified canonical link (which points back to the endpoint as specified by the data producer).\nThe notification is always published by the Global Cache regardless to the `cache` topic.\n",
          "default": true
        },
        "integrity": {
          "type": "object",
          "description": "Specifies a checksum to be applied to the data to ensure that the download is accurate.",
          "properties": {
            "method": {
              "type": "string",
              "description": "A specific set of methods for calculating the checksum algorithms:\n* ``sha256``: the Secure Hash Algorithm 2, 256 bits, value is base64 encoded.\n* ``sha384``: the Secure Hash Algorithm 2, 384 bits, value is base64 encoded.\n* ``sha512``: the Secure Hash Algorithm 2, 512 bits, value is base64 encoded.\n* ``sha3-256``: the Secure Hash Algorithm 3, 256 bits, value is base64 encoded.\n* ``sha3-384``: the Secure Hash Algorithm 3, 384 bits, value is base64 encoded.\n* ``sha3-512``: the Secure Hash Algorithm 3, 512 bits, value is base64 encoded.\n",
              "enum": [
                "sha256",
                "sha384",
                "sha512",
                "sha3-256",
                "sha3-384",
                "sha3-512"
              ]
            },
            "value": {
              "type": "string",
              "contentEncoding": "base64",
              "description": "Checksum value."
            }
          },
          "required": [
            "method",
            "value"
          ]
        },
        "content": {
          "type": "object",
          "description": "Used to embed small products inline within the message.",
          "properties": {
            "encoding": {
              "type": "string",
              "description": "Encoding of content",
              "enum": [
                "utf-8",
                "base64",
                "gzip"
              ]
            },
            "size": {
              "type": "integer",
              "description": "Number of bytes contained in the file. Together with the ``integrity`` property, it provides additional assurance that file content was accurately received.\nNote that the limit takes into account the data encoding used, including data compression (for example `gzip`).\n"
            },
            "value": {
              "type": "string",
              "description": "The inline content of the file.",
              "maxLength": 4096
            }
          },
          "required": [
            "encoding",
            "size",
            "value"
          ]
        }
      },
      "required": [
        "pubtime",
        "data_id",
        "metadata_id"
      ],
      "oneOf": [
        {
          "allOf": [
            {
              "required": [
                "start_datetime",
                "end_datetime"
              ]
            }
          ]
        },
        {
          "allOf": [
            {
              "required": [
                "datetime"
              ]
            }
          ]
        }
      ]
    },
    "links": {
      "type": "array",
      "minItems": 1,
      "items": {
        "allOf": [
          {
            "allOf": [
              {
                "type": "object",
                "required": [
                  "rel"
                ],
                "properties": {
                  "rel": {
                    "type": "string",
                    "description": "The type or semantics of the relation.",
                    "example": "alternate"
                  },
                  "type": {
                    "type": "string",
                    "description": "A hint indicating what the media type of the result of dereferencing the link should be.",
                    "example": "application/geo+json"
                  },
                  "hreflang": {
                    "type": "string",
                    "description": "A hint indicating what the language of the result of dereferencing the link should be.",
                    "example": "en"
                  },
                  "title": {
                    "type": "string",
                    "description": "Used to label the destination of a link such that it can be used as a human-readable identifier.",
                    "example": "Trierer Strasse 70, 53115 Bonn"
                  },
                  "length": {
                    "type": "integer"
                  }
                }
              },
              {
                "type": "object",
                "required": [
                  "href"
                ],
                "properties": {
                  "href": {
                    "type": "string",
                    "description": "The URI of the link target.",
                    "example": "https://example.com/data/buildings/123"
                  }
                }
              }
            ]
          },
          {
            "properties": {
              "security": {
                "type": "object",
                "patternProperties": {
                  "^[a-zA-Z0-9\\.\\-_]+$": {
                    "oneOf": [
                      {
                        "$ref": "#/definitions/Schema_Reference"
                      },
                      {
                        "$ref": "#/definitions/Schema_SecurityScheme"
                      }
                    ]
                  }
                }
              }
            }
          }
        ]
      }
    }
  },
  "required": [
    "id",
    "conformsTo",
    "type",
    "geometry",
    "properties",
    "links"
  ],
  "example": {
    "id": "31e9d66a-cd83-4174-9429-b932f1abe1be",
    "conformsTo": [
      "http://wis.wmo.int/spec/wnm/1/conf/core"
    ],
    "type": "Feature",
    "geometry": {
      "type": "Point",
      "coordinates": [
        6.146255135536194,
        46.223296618227444
      ]
    },
    "properties": {
      "pubtime": "2022-03-20T04:50:18Z",
      "datetime": "2022-03-20T04:45:00Z",
      "integrity": {
        "method": "sha512",
        "value": "A2KNxvks...S8qfSCw=="
      },
      "data_id": "dataset/123/data-granule/UANT01_CWAO_200445___15103.bufr4",
      "metadata_id": "urn:wmo:md:ca-eccc-msc:observations.swob",
      "content": {
        "encoding": "utf-8",
        "value": "encoded bytes from the file",
        "size": 457
      }
    },
    "links": [
      {
        "href": "https://example.org/data/4Pubsub/92c557ef-d28e-4713-91af-2e2e7be6f8ab.bufr4",
        "rel": "canonical",
        "type": "application/bufr"
      },
      {
        "href": "https://example.org/oapi/collections/my-dataset/items/my-data-granule",
        "rel": "item",
        "type": "application/json"
      }
    ]
  },
  "definitions": {
    "Schema_APIKeySecurityScheme": {
      "type": "object",
      "required": [
        "type",
        "name",
        "in"
      ],
      "properties": {
        "type": {
          "type": "string",
          "enum": [
            "apiKey"
          ]
        },
        "name": {
          "type": "string"
        },
        "in": {
          "type": "string",
          "enum": [
            "header",
            "query",
            "cookie"
          ]
        },
        "description": {
          "type": "string"
        }
      },
      "patternProperties": {
        "^x-": {}
      },
      "additionalProperties": false
    },
    "Schema_AuthorizationCodeOAuthFlow": {
      "type": "object",
      "required": [
        "authorizationUrl",
        "tokenUrl"
      ],
      "properties": {
        "authorizationUrl": {
          "type": "string",
          "format": "uri-reference"
        },
        "tokenUrl": {
          "type": "string",
          "format": "uri-reference"
        },
        "refreshUrl": {
          "type": "string",
          "format": "uri-reference"
        },
        "scopes": {
          "type": "object",
          "additionalProperties": {
            "type": "string"
          }
        }
      },
      "patternProperties": {
        "^x-": {}
      },
      "additionalProperties": false
    },
    "Schema_ClientCredentialsFlow": {
      "type": "object",
      "required": [
        "tokenUrl"
      ],
      "properties": {
        "tokenUrl": {
          "type": "string",
          "format": "uri-reference"
        },
        "refreshUrl": {
          "type": "string",
          "format": "uri-reference"
        },
        "scopes": {
          "type": "object",
          "additionalProperties": {
            "type": "string"
          }
        }
      },
      "patternProperties": {
        "^x-": {}
      },
      "additionalProperties": false
    },
    "Schema_HTTPSecurityScheme": {
      "type": "object",
      "required": [
        "scheme",
        "type"
      ],
      "properties": {
        "scheme": {
          "type": "string"
        },
        "bearerFormat": {
          "type": "string"
        },
        "description": {
          "type": "string"
        },
        "type": {
          "type": "string",
          "enum": [
            "http"
          ]
        }
      },
      "patternProperties": {
        "^x-": {}
      },
      "additionalProperties": false,
      "oneOf": [
        {
          "description": "Bearer",
          "properties": {
            "scheme": {
              "enum": [
                "bearer"
              ]
            }
          }
        },
        {
          "description": "Non Bearer",
          "not": {
            "required": [
              "bearerFormat"
            ]
          },
          "properties": {
            "scheme": {
              "not": {
                "enum": [
                  "bearer"
                ]
              }
            }
          }
        }
      ]
    },
    "Schema_ImplicitOAuthFlow": {
      "type": "object",
      "required": [
        "authorizationUrl",
        "scopes"
      ],
      "properties": {
        "authorizationUrl": {
          "type": "string",
          "format": "uri-reference"
        },
        "refreshUrl": {
          "type": "string",
          "format": "uri-reference"
        },
        "scopes": {
          "type": "object",
          "additionalProperties": {
            "type": "string"
          }
        }
      },
      "patternProperties": {
        "^x-": {}
      },
      "additionalProperties": false
    },
    "Schema_OAuth2SecurityScheme": {
      "type": "object",
      "required": [
        "type",
        "flows"
      ],
      "properties": {
        "type": {
          "type": "string",
          "enum": [
            "oauth2"
          ]
        },
        "flows": {
          "$ref": "#/definitions/Schema_OAuthFlows"
        },
        "description": {
          "type": "string"
        }
      },
      "patternProperties": {
        "^x-": {}
      },
      "additionalProperties": false
    },
    "Schema_OAuthFlows": {
      "type": "object",
      "properties": {
        "implicit": {
          "$ref": "#/definitions/Schema_ImplicitOAuthFlow"
        },
        "password": {
          "$ref": "#/definitions/Schema_PasswordOAuthFlow"
        },
        "clientCredentials": {
          "$ref": "#/definitions/Schema_ClientCredentialsFlow"
        },
        "authorizationCode": {
          "$ref": "#/definitions/Schema_AuthorizationCodeOAuthFlow"
        }
      },
      "patternProperties": {
        "^x-": {}
      },
      "additionalProperties": false
    },
    "Schema_OpenIdConnectSecurityScheme": {
      "type": "object",
      "required": [
        "type",
        "openIdConnectUrl"
      ],
      "properties": {
        "type": {
          "type": "string",
          "enum": [
            "openIdConnect"
          ]
        },
        "openIdConnectUrl": {
          "type": "string",
          "format": "uri-reference"
        },
        "description": {
          "type": "string"
        }
      },
      "patternProperties": {
        "^x-": {}
      },
      "additionalProperties": false
    },
    "Schema_PasswordOAuthFlow": {
      "type": "object",
      "required": [
        "tokenUrl"
      ],
      "properties": {
        "tokenUrl": {
          "type": "string",
          "format": "uri-reference"
        },
        "refreshUrl": {
          "type": "string",
          "format": "uri-reference"
        },
        "scopes": {
          "type": "object",
          "additionalProperties": {
            "type": "string"
          }
        }
      },
      "patternProperties": {
        "^x-": {}
      },
      "additionalProperties": false
    },
    "Schema_Reference": {
      "type": "object",
      "required": [
        "$ref"
      ],
      "patternProperties": {
        "^\\$ref$": {
          "type": "string",
          "format": "uri-reference"
        }
      }
    },
    "Schema_SecurityScheme": {
      "oneOf": [
        {
          "$ref": "#/definitions/Schema_APIKeySecurityScheme"
        },
        {
          "$ref": "#/definitions/Schema_HTTPSecurityScheme"
        },
        {
          "$ref": "#/definitions/Schema_OAuth2SecurityScheme"
        },
        {
          "$ref": "#/definitions/Schema_OpenIdConnectSecurityScheme"
        }
      ]
    }
  }
}
