{
    "id": "31e9d66a-cd83-4174-9429-b932f1abe1be",
    "conformsTo": [
        "http://wis.wmo.int/spec/wnm/1/conf/core"
    ],
    "type": "Feature",
    "geometry": {
        "type": "Polygon",
        "coordinates": [
            [
                [
                    -7.75,
                    40.43
                ],
                [
                    -7.75,
                    78.46
                ],
                [
                    71.91,
                    78.46
                ],
                [
                    71.91,
                    40.43
                ],
                [
                    -7.75,
                    40.43
                ]
            ]
        ]
    },
    "properties": {
        "pubtime": "2022-03-20T04:50:18Z",
        "start_datetime": "2022-03-20T00:06:00Z",
        "end_datetime": "2022-03-20T00:12:00Z",
        "integrity": {
            "method": "sha512",
            "value": "A2KNxvks...S8qfSCw=="
        },
        "data_id": "dataset/4546/abcdef-abcd-abcd-abcd-abcdefabcd",
        "metadata_id": "urn:wmo:md:fr-meteo-france:gap123"
    },
    "links": [
        {
            "href": "https://example.org/data/nwp/92c557ef-d28e-4713-91af-2e2e7be6f8ab.grib",
            "rel": "canonical",
            "type": "application/x-grib2"
        }
    ]
}
